{
  "schema_version": "FORM-DEFINITION-001",
  "status": "DRAFT",
  "form": {
    "code": "FORM_CONDITIONAL_RULES",
    "name": "Formulario de Reglas Condicionales",
    "form_type": "OT_CHECKLIST",
    "target_response_table": "respuestas_checklist_orden",
    "version": "1.0",
    "sections": [
      {
        "code": "SEC_RULES",
        "title": "Reglas de Visibilidad",
        "order": 1,
        "fields": [
          {
            "code": "f_status",
            "label": "Cumple Inspección Visual",
            "field_type": "YES_NO",
            "required": true,
            "order": 1,
            "options": [
              "Sí",
              "No"
            ]
          },
          {
            "code": "f_obs",
            "label": "Detalle de Falla (Si No Cumple)",
            "field_type": "TEXTAREA",
            "required": true,
            "order": 2,
            "visibility_rule": {
              "when": {
                "field": "f_status",
                "operator": "EQUALS",
                "value": "No"
              },
              "action": {
                "type": "SHOW",
                "target": "f_obs"
              }
            }
          },
          {
            "code": "f_invalid_rule",
            "label": "Campo con Regla Inválida",
            "field_type": "TEXT",
            "required": false,
            "order": 3,
            "visibility_rule": {
              "when": {
                "field": "NON_EXISTENT_FIELD",
                "operator": "EQUALS",
                "value": "x"
              },
              "action": {
                "type": "SHOW",
                "target": "f_invalid_rule"
              }
            }
          }
        ]
      }
    ]
  },
  "warnings": [],
  "unsupported_components": [],
  "requires_human_review": false
}