{
  "schema_version": "FORM-DEFINITION-001",
  "status": "DRAFT",
  "form": {
    "code": "FORM_ALL_18_TYPES",
    "name": "Formulario con 18 Tipos de Campos Autorizados",
    "form_type": "OT_CHECKLIST",
    "target_response_table": "respuestas_checklist_orden",
    "version": "1.0",
    "sections": [
      {
        "code": "SEC_DATOS",
        "title": "Datos Contextuales",
        "order": 1,
        "fields": [
          {
            "code": "f_folio",
            "label": "Folio Orden",
            "field_type": "READ_ONLY",
            "required": true,
            "order": 1,
            "source": "CONTEXT",
            "persist_response": false
          },
          {
            "code": "f_maquina",
            "label": "Máquina Telar",
            "field_type": "MACHINE_SELECTOR",
            "required": true,
            "order": 2
          },
          {
            "code": "f_tecnico",
            "label": "Técnico Asignado",
            "field_type": "TECHNICIAN_SELECTOR",
            "required": true,
            "order": 3
          }
        ]
      },
      {
        "code": "SEC_CAMPOS",
        "title": "Campos de Inspección",
        "order": 2,
        "fields": [
          {
            "code": "f_text",
            "label": "Observaciones Iniciales",
            "field_type": "TEXT",
            "required": false,
            "order": 1,
            "placeholder": "Ingrese texto"
          },
          {
            "code": "f_textarea",
            "label": "Descripción Detallada",
            "field_type": "TEXTAREA",
            "required": false,
            "order": 2
          },
          {
            "code": "f_int",
            "label": "Lectura Contador (Horas)",
            "field_type": "INTEGER",
            "required": true,
            "order": 3,
            "min": 0,
            "max": 100000
          },
          {
            "code": "f_dec",
            "label": "Medición mm/s",
            "field_type": "DECIMAL",
            "required": true,
            "order": 4,
            "min": 0,
            "max": 50
          },
          {
            "code": "f_date",
            "label": "Fecha Inspección",
            "field_type": "DATE",
            "required": true,
            "order": 5
          },
          {
            "code": "f_datetime",
            "label": "Fecha y Hora Cierre",
            "field_type": "DATETIME",
            "required": true,
            "order": 6
          },
          {
            "code": "f_bool",
            "label": "Conforme con Normas",
            "field_type": "BOOLEAN",
            "required": false,
            "order": 7
          },
          {
            "code": "f_yesno",
            "label": "Cumple Inspección Visual",
            "field_type": "YES_NO",
            "required": true,
            "order": 8,
            "options": [
              "Sí",
              "No",
              "N/A"
            ]
          },
          {
            "code": "f_select",
            "label": "Turno Trabajo",
            "field_type": "SELECT",
            "required": true,
            "order": 9,
            "options": [
              "Turno 1",
              "Turno 2",
              "Turno 3"
            ]
          },
          {
            "code": "f_multiselect",
            "label": "Componentes Revisados",
            "field_type": "MULTISELECT",
            "required": false,
            "order": 10,
            "options": [
              "Motor",
              "Rodamientos",
              "Banda",
              "Sensores"
            ]
          },
          {
            "code": "f_check",
            "label": "Puntos de Grasa",
            "field_type": "CHECKBOX",
            "required": false,
            "order": 11,
            "options": [
              "Punto A",
              "Punto B",
              "Punto C"
            ]
          },
          {
            "code": "f_radio",
            "label": "Calificación Falla",
            "field_type": "RADIO",
            "required": true,
            "order": 12,
            "options": [
              "Leve",
              "Moderada",
              "Crítica"
            ]
          },
          {
            "code": "f_photo",
            "label": "Evidencia Fotográfica",
            "field_type": "PHOTO",
            "required": true,
            "order": 13,
            "storage_type": "EVIDENCE"
          },
          {
            "code": "f_file",
            "label": "Reporte Escaneado",
            "field_type": "FILE",
            "required": false,
            "order": 14,
            "storage_type": "EVIDENCE"
          },
          {
            "code": "f_sig",
            "label": "Firma Conformidad",
            "field_type": "SIGNATURE",
            "required": true,
            "order": 15,
            "storage_type": "EVIDENCE"
          }
        ]
      }
    ]
  },
  "warnings": [],
  "unsupported_components": [],
  "requires_human_review": false
}